#,Title,Published Date,ArXiv URL,Key Insights
34,Gradient Routing: Masking Gradients to Localize Computation in Neural Networks,2024-10-06,http://arxiv.org/abs/2410.04332v2,"Gradient routing offers a method to enforce modularity in neural networks, allowing for more targeted interventions and oversight. This is crucial for scalable oversight as it allows focusing on specific modules responsible for undesirable behaviors., The ability to robustly unlearn specific capabilities by ablating pre-specified network subregions is a significant step towards AI safety. This allows for removing harmful capabilities without retraining the entire network, which is essential for responding to unforeseen risks., The paper demonstrates the potential for scalable oversight in reinforcement learning by localizing modules responsible for different behaviors. This could enable more efficient monitoring and intervention in complex RL agents."
35,Possible Principles for Aligned Structure Learning Agents,2024-09-30,http://arxiv.org/abs/2410.00258v3,"The paper highlights the importance of structure learning (causal representation learning) as a foundation for scalable alignment. Agents that can accurately model the world, including other agents' preferences and beliefs (Theory of Mind), are more likely to be aligned., The paper suggests that incorporating 'core knowledge' and model reduction techniques can improve the efficiency and accuracy of structure learning, making it more scalable for complex environments., The paper explores formalizing alignment principles, such as Asimov's Laws, within a structure learning framework. This provides a potential pathway for embedding ethical constraints directly into the agent's world model."
36,Training Language Models to Win Debates with Self-Play Improves Judge Accuracy,2024-09-25,http://arxiv.org/abs/2409.16636v1,"Training language models to win debates through self-play can improve the accuracy of language model-based judges in evaluating complex tasks, suggesting a potential path for scalable oversight., Debate training appears to encourage the development of stronger and more informative arguments compared to consultancy-based approaches, indicating that debate may be a more effective method for eliciting useful information from AI systems., The study highlights the potential of using adversarial training (debate) to improve the reliability of AI evaluators, which is crucial for ensuring the safety and alignment of increasingly capable AI agents."
37,"Explanation, Debate, Align: A Weak-to-Strong Framework for Language Model Generalization",2024-09-11,http://arxiv.org/abs/2409.07335v1,"Weak-to-strong generalization offers a pathway for transferring alignment properties from advanced, potentially more aligned, models to weaker ones, reducing the need for extensive, potentially biased, training data for each individual model., Explanation generation, when integrated into a weak-to-strong framework, can provide insights into the alignment status of both the strong and weak models, enabling a better understanding of how alignment is transferred and where potential misalignments might arise., The facilitation function concept provides a structured way to formalize and analyze the transfer of capabilities, including alignment, between models, which is crucial for developing scalable oversight mechanisms."
38,AI-Assisted Generation of Difficult Math Questions,2024-07-30,http://arxiv.org/abs/2407.21009v4,"The paper demonstrates a method for generating 'out-of-distribution' (OOD) examples that are difficult for both LLMs and humans. This is valuable for scalable oversight because OOD examples can expose weaknesses and vulnerabilities in AI systems that might not be apparent from standard training data., The human-in-the-loop approach, where LLMs generate and refine questions, and humans verify and further refine them, offers a potential framework for scalable oversight. LLMs can automate the generation of test cases, while humans provide crucial validation and refinement, ensuring quality and relevance., The observed relationship between model performance on the original dataset and the new, more difficult dataset (MATH$^2$) suggests a way to quantify the 'difficulty' of a task and potentially identify areas where models struggle with combining different skills. This could inform targeted interventions to improve model robustness and generalization."
39,ANAH-v2: Scaling Analytical Hallucination Annotation of Large Language Models,2024-07-05,http://arxiv.org/abs/2407.04693v2,"The paper introduces a scalable approach to detect and mitigate hallucinations in LLMs, a critical aspect of ensuring AI safety and reliability. By automating the annotation process, it addresses the bottleneck of manual annotation, enabling the creation of larger and more diverse datasets for training hallucination detectors., The self-training framework, based on the Expectation Maximization (EM) algorithm, demonstrates a promising method for iteratively improving both the annotation dataset and the hallucination annotator. This approach can be adapted to other areas of AI safety where labeled data is scarce or expensive to obtain., The finding that a relatively small (7B parameter) model can outperform GPT-4 in hallucination detection suggests that specialized models trained on high-quality, iteratively refined datasets can be more effective than general-purpose LLMs for specific oversight tasks."
40,On scalable oversight with weak LLMs judging strong LLMs,2024-07-05,http://arxiv.org/abs/2407.04622v2,"Debate, where two AI agents argue to convince a weaker AI judge, consistently outperforms consultancy (single AI trying to convince a judge) when the consultant is randomly assigned to argue for a specific answer, suggesting debate is a more robust oversight mechanism., The effectiveness of debate compared to direct question answering depends on the task. Debate excels in tasks with information asymmetry (e.g., extractive QA), but its advantage is less clear in tasks without such asymmetry (e.g., mathematics, coding, logic)., Allowing debaters to choose which answer to argue for (rather than being assigned one) improves judge accuracy, indicating that strategic agent behavior can be harnessed to improve oversight."
41,Easy-to-Hard Generalization: Scalable Alignment Beyond Human Supervision,2024-03-14,http://arxiv.org/abs/2403.09472v2,"Training reward models on easier tasks can enable effective evaluation and improvement of AI agents on harder tasks, even surpassing human-level performance on those harder tasks., Process supervision (i.e., supervising the reasoning steps) during reward model training on easier tasks is crucial for effective generalization to harder tasks., Easy-to-hard generalization can be achieved through re-ranking or reinforcement learning, using the reward model trained on easier tasks to guide the agent's learning on harder tasks."
42,On the Essence and Prospect: An Investigation of Alignment Approaches for Big Models,2024-03-07,http://arxiv.org/abs/2403.04204v1,"The paper highlights the inherent challenges in aligning large models, including data costs and scalable oversight, emphasizing that finding the optimal alignment strategy remains an open problem., The survey categorizes alignment methods into Reinforcement Learning, Supervised Fine-Tuning, and In-context Learning, providing a structured overview of their strengths and limitations, which is crucial for understanding the trade-offs in different oversight approaches., The discussion of emerging topics like personal and multimodal alignment suggests future research directions that could impact how we tailor oversight mechanisms to specific users and diverse data modalities."
43,CriticEval: Evaluating Large Language Model as Critic,2024-02-21,http://arxiv.org/abs/2402.13764v5,"The paper introduces a benchmark (CriticEval) specifically designed to evaluate the critique ability of LLMs, which is a critical component for scalable oversight as it allows LLMs to identify and correct their own flaws or the flaws of other AI systems., The benchmark evaluates critique ability across multiple dimensions and task scenarios, providing a more comprehensive assessment than existing methods. This is important because different tasks and types of errors may require different critique strategies., The use of GPT-4 to evaluate textual critiques, leveraging a large number of reference annotations, enhances the reliability of the evaluation process. This is crucial for ensuring that the benchmark accurately reflects the true critique capabilities of LLMs."
44,Improving Weak-to-Strong Generalization with Scalable Oversight and Ensemble Learning,2024-02-01,http://arxiv.org/abs/2402.00667v1,"The paper directly addresses the challenge of aligning increasingly capable AI systems with human values through the Weak-to-Strong Generalization (W2SG) framework, which is a core concern in scalable oversight., The use of ensemble learning to improve the quality of weak supervision is a promising approach for reducing the capability gap between weak teachers (e.g., human supervisors or automated evaluators) and strong student models, making oversight more effective., Exploring human-AI interaction and AI-AI debate as scalable oversight mechanisms offers practical avenues for improving the reliability and scalability of supervision signals."
45,Reinforcement Learning from LLM Feedback to Counteract Goal Misgeneralization,2024-01-14,http://arxiv.org/abs/2401.07181v1,"LLMs can provide effective, scalable oversight for RL agents, even without task proficiency, by identifying potential goal misgeneralization scenarios., Using LLM feedback to shape the reward function can significantly improve an RL agent's ability to generalize to the intended goal, especially when the true and proxy goals are distinguishable., The method is particularly effective in mitigating behavioral biases that lead to goal misgeneralization."
46,The Unreasonable Effectiveness of Easy Training Data for Hard Tasks,2024-01-12,http://arxiv.org/abs/2401.06751v2,"Language models exhibit surprisingly strong generalization from easy to hard data, potentially reducing the need for expensive and noisy hard-labeled data in some contexts., Collecting and utilizing easy data for finetuning can be more effective than focusing solely on hard data, especially when considering the cost and reliability of labeling., The effectiveness of easy-to-hard generalization varies depending on the task and the specific measure of data hardness used."
47,GPQA: A Graduate-Level Google-Proof Q&A Benchmark,2023-11-20,http://arxiv.org/abs/2311.12022v1,"GPQA provides a challenging benchmark for evaluating scalable oversight methods, as it requires AI systems to answer questions that are difficult even for skilled humans with access to external information., The dataset's difficulty highlights the need for oversight techniques that can effectively supervise AI systems that surpass human capabilities, particularly in domains requiring expert knowledge., The performance gap between experts and non-experts on GPQA suggests that effective oversight may require supervisors with domain-specific knowledge or methods to augment non-expert understanding."
48,A Closer Look at the Self-Verification Abilities of Large Language Models in Logical Reasoning,2023-11-14,http://arxiv.org/abs/2311.07954v2,"LLMs struggle to accurately identify logical fallacies in their own reasoning, suggesting limitations in their self-verification abilities., The inability to reliably detect fallacies undermines the effectiveness of self-verification methods for improving reasoning performance., The FALLACIES dataset provides a valuable resource for evaluating and improving the self-verification capabilities of LLMs in logical reasoning contexts."
49,SALMON: Self-Alignment with Instructable Reward Models,2023-10-09,http://arxiv.org/abs/2310.05910v2,"SALMON offers a pathway to reduce reliance on extensive human feedback by using an instructable reward model trained on synthetic preference data derived from human-defined principles. This is crucial for scaling oversight to complex tasks where obtaining consistent human annotations is difficult., The controllability afforded by adjusting principles during RL training allows for dynamic adaptation of the AI agent's behavior, potentially enabling more flexible and targeted safety interventions., The method's strong performance with minimal human supervision (6 exemplars, 31 principles) suggests a significant improvement in sample efficiency, making alignment more practical for resource-constrained settings."
50,Assessing Large Language Models on Climate Information,2023-10-04,http://arxiv.org/abs/2310.02932v2,"LLMs exhibit a significant gap between surface-level fluency and epistemological accuracy when communicating about climate change, highlighting the need for careful oversight to ensure factual correctness and avoid misinformation., The paper introduces a novel protocol for scalable oversight that leverages AI assistance and human raters with relevant education, providing a practical approach to evaluating LLM performance in specialized domains., The evaluation framework, grounded in science communication research, offers a comprehensive and fine-grained analysis of LLM responses, considering both presentational and epistemological dimensions, which is crucial for identifying subtle biases and inaccuracies."
51,"Explainability in AI Policies: A Critical Review of Communications, Reports, Regulations, and Standards in the EU, US, and UK",2023-04-20,http://arxiv.org/abs/2304.11218v1,"Current AI policies regarding explainability are often based on coarse notions and requirements, potentially hindering practical adoption and effective oversight., A lack of consensus on what constitutes a valid algorithmic explanation and the feasibility of its implementation across stakeholders poses a significant challenge to effective AI oversight., Policies primarily frame explainability as a risk management tool, potentially overlooking other crucial aspects like user understanding and trust."
52,Diagnostics for Deep Neural Networks with Automated Copy/Paste Attacks,2022-11-18,http://arxiv.org/abs/2211.10024v3,"Automated methods like SNAFUE can significantly enhance scalable oversight by efficiently identifying vulnerabilities in DNNs that might be missed by human reviewers or traditional adversarial example techniques., The use of interpretable adversarial attacks, specifically copy/paste attacks, facilitates human understanding of DNN weaknesses, making it easier to diagnose and address underlying issues., Red teaming with automated copy/paste attacks can reveal a large number of easily-describable vulnerabilities, highlighting the potential for these attacks to serve as a practical diagnostic tool for AI safety."
53,Measuring Progress on Scalable Oversight for Large Language Models,2022-11-04,http://arxiv.org/abs/2211.03540v2,"Human-AI collaboration, even with an unreliable AI assistant, can significantly outperform both unaided humans and the AI model alone on complex tasks., The paper provides a concrete experimental design for studying scalable oversight with current language models by focusing on tasks where human specialists excel but unaided humans and current AI fail., The study demonstrates the viability of using chat-based interaction with language models as a baseline strategy for scalable oversight, suggesting that even simple oversight mechanisms can yield substantial improvements."
