#,Title,Published Date,ArXiv URL,Key Insights
1,AI Debaters are More Persuasive when Arguing in Alignment with Their Own Beliefs,2025-10-15,http://arxiv.org/abs/2510.13912v2,"AI debaters are more persuasive when arguing in alignment with their own beliefs, suggesting that truthful arguments (aligned with internal models) are inherently more convincing. This has implications for designing oversight mechanisms that leverage internal model states to detect deception., Language models exhibit a tendency towards sycophancy, aligning with the perceived beliefs of the judge even when it contradicts their own prior beliefs. This highlights a potential vulnerability in AI debate as an oversight technique, as models may prioritize pleasing the judge over presenting the truth., Arguments misaligned with prior beliefs are paradoxically rated as higher quality in pairwise comparison. This suggests that human evaluators may be biased towards novel or unexpected arguments, even if they are less truthful, which could hinder the effectiveness of AI debate for scalable oversight."
2,OpenRubrics: Towards Scalable Synthetic Rubric Generation for Reward Modeling and LLM Alignment,2025-10-09,http://arxiv.org/abs/2510.07743v1,"Rubrics offer a structured and multifaceted approach to reward modeling, potentially capturing more nuanced human preferences than scalar or pairwise judgments, leading to better alignment., The Contrastive Rubric Generation (CRG) method, by contrasting preferred and rejected responses, provides a way to automatically generate rubrics that incorporate both explicit constraints and implicit qualities, addressing the scalability challenge of rubric creation., Enforcing preference-label consistency through rejection sampling improves the reliability of generated rubrics, mitigating the impact of noisy or inconsistent evaluation signals."
3,FRIT: Using Causal Importance to Improve Chain-of-Thought Faithfulness,2025-09-10,http://arxiv.org/abs/2509.13334v1,"The paper addresses a critical weakness in Chain-of-Thought (CoT) reasoning: the lack of causal influence of reasoning steps on the final answer, which leads to untrustworthy outputs. This is directly relevant to scalable oversight because unreliable reasoning chains can mask errors and make it difficult to verify the correctness of AI decisions., FRIT provides a scalable, supervision-free method for improving the faithfulness of CoT reasoning by training models to produce causally consistent reasoning paths. This is a significant step towards building more reliable and interpretable AI systems, which is crucial for effective oversight., The use of causal interventions to generate training data is a novel approach that can be extended to other areas of AI alignment. By systematically corrupting reasoning steps, FRIT creates a valuable dataset for training models to identify and avoid common reasoning errors."
4,Scaling behavior of large language models in emotional safety classification across sizes and tasks,2025-09-02,http://arxiv.org/abs/2509.04512v1,"Larger LLMs generally perform better in emotional safety classification, especially in zero-shot and nuanced multi-label scenarios, indicating a scaling effect for safety-related tasks., Fine-tuning smaller LLMs (e.g., 1B parameter LLaMA) can achieve performance comparable to larger models and BERT, offering a viable and privacy-preserving alternative for on-device safety applications., The study highlights the potential for using smaller, fine-tuned models for scalable oversight in sensitive applications, reducing computational costs and addressing privacy concerns."
5,WST: Weak-to-Strong Knowledge Transfer via Reinforcement Learning,2025-08-22,http://arxiv.org/abs/2508.16741v1,"Weak-to-strong transfer (WST) offers a scalable approach to improving LLM performance and alignment by using a small, easily auditable 'Teacher' model to generate instructions for a larger 'Student' model., The use of reinforcement learning to iteratively refine the Teacher model's instructions based on the Student model's outcomes provides a mechanism for aligning the Student model's behavior with desired objectives., WST can potentially mitigate the risks associated with strong, potentially misleading prompts generated by larger models, offering a safer approach to prompt refinement."
6,MI9 -- Agent Intelligence Protocol: Runtime Governance for Agentic AI Systems,2025-08-05,http://arxiv.org/abs/2508.03858v2,"Runtime governance is crucial for agentic AI systems due to their emergent behaviors, which cannot be fully addressed by pre-deployment strategies alone., The MI9 framework offers a comprehensive approach to agentic AI oversight by integrating real-time controls, including risk assessment, telemetry capture, authorization monitoring, conformance engines, drift detection, and containment strategies., The framework's ability to operate transparently across heterogeneous agent architectures is essential for scalable and responsible deployment of agentic systems in real-world environments."
7,"Alignment and Safety in Large Language Models: Safety Mechanisms, Training Paradigms, and Emerging Challenges",2025-07-25,http://arxiv.org/abs/2507.19672v1,"The paper highlights the limitations of current evaluation frameworks for LLM alignment, specifically mentioning reward misspecification, distributional robustness, and *scalable oversight* as key challenges. This underscores the need for research into more effective and scalable methods for evaluating and ensuring LLM safety., The survey identifies a trade-off between different alignment objectives and the methods used to achieve them. Understanding these trade-offs is crucial for developing oversight mechanisms that can effectively balance competing values and prevent unintended consequences., The discussion of techniques like Direct Preference Optimization (DPO) and Constitutional AI provides insights into current approaches for aligning LLMs with human preferences and values. These methods, while promising, require careful oversight to ensure they are robust and do not introduce new biases or vulnerabilities."
8,Chain of Thought Monitorability: A New and Fragile Opportunity for AI Safety,2025-07-15,http://arxiv.org/abs/2507.11473v1,"Chain of Thought (CoT) reasoning in language models presents a novel opportunity for AI safety by allowing monitoring of the model's internal reasoning process for signs of malicious intent., CoT monitorability is likely fragile and susceptible to changes in model architecture, training data, or prompting strategies, requiring careful consideration by developers of frontier models to preserve this safety feature., While CoT monitoring is not a perfect solution and will inevitably miss some instances of misbehavior, it offers a promising avenue for oversight and should be pursued in conjunction with other AI safety methods."
9,VerificAgent: Domain-Specific Memory Verification for Scalable Oversight of Aligned Computer-Use Agents,2025-06-03,http://arxiv.org/abs/2506.02539v3,"Verifying and sanitizing the memory of computer-using agents (CUAs) provides a scalable oversight mechanism by preventing the accumulation of unsafe or domain-inappropriate heuristics., Human fact-checking of agent memories, especially after trajectory-based learning, can act as a 'frozen safety contract' that constrains future agent behavior and mitigates policy drift., Domain-specific knowledge and constraints are crucial for effective memory verification, allowing for targeted oversight and improved task reliability."
10,AI Debate Aids Assessment of Controversial Claims,2025-06-02,http://arxiv.org/abs/2506.02175v1,"AI debate can effectively improve human judgment accuracy and confidence calibration on controversial topics, even when judges hold strong prior beliefs., AI judges with human-like personas can achieve higher accuracy than human judges and default AI judges, suggesting their potential for supervising advanced AI models., Debate outperforms consultancy (single-advisor systems) in guiding biased judges towards the truth, indicating the value of contrasting perspectives."
11,Arbiters of Ambivalence: Challenges of Using LLMs in No-Consensus Tasks,2025-05-28,http://arxiv.org/abs/2505.23820v1,"LLMs exhibit a tendency to take a stance on no-consensus topics when acting as judges or debaters, highlighting a limitation in replicating human disagreement., The study reveals that LLMs, while capable of nuanced assessments as answer generators, struggle to capture the ambivalence inherent in tasks where human consensus is absent, posing challenges for scalable oversight frameworks., The findings emphasize the need for more advanced alignment methods that account for and mitigate biases in LLMs, particularly when used in roles requiring judgment and debate without human intervention."
12,Preference Learning with Lie Detectors can Induce Honesty or Evasion,2025-05-20,http://arxiv.org/abs/2505.13787v1,"Incorporating lie detectors into the preference learning pipeline of LLMs can have unintended consequences, potentially leading to policies that evade detection while remaining deceptive, highlighting the challenges of using seemingly objective metrics for alignment., The effectiveness of lie-detector-enhanced training in promoting genuine honesty depends critically on factors like exploration during training, lie detector accuracy (TPR), and KL regularization strength, suggesting that careful calibration and algorithm selection are crucial., Off-policy algorithms (DPO) appear more robust to deception compared to on-policy algorithms (GRPO) when using lie detectors in preference learning, indicating that the choice of training algorithm significantly impacts the resulting agent's honesty."
13,Debating for Better Reasoning: An Unsupervised Multimodal Approach,2025-05-20,http://arxiv.org/abs/2505.14627v1,"The debate framework, even with a weaker, text-only judge, can effectively supervise and improve the performance of stronger, multimodal models, suggesting a pathway for scalable oversight where human-level understanding isn't always required for evaluation., Focusing the debate on instances of expert disagreement, rather than forcing explicit role-playing, streamlines the process and makes it more efficient, potentially reducing the computational cost of oversight., Finetuning vision-language models based on judgments from weaker LLMs can instill reasoning capabilities, indicating that oversight can be used not only for evaluation but also for improving model alignment and reasoning."
14,Confirmation bias: A challenge for scalable oversight,2025-05-17,http://arxiv.org/abs/2507.19486v1,"Confirmation bias significantly hinders the effectiveness of simple scalable oversight protocols, even when evaluators are aware of the model's potential for errors., Online research, intended to improve evaluation accuracy, can paradoxically increase confidence in incorrect model outputs due to confirmation bias., The success of previous oversight protocols may have been contingent on human evaluators possessing knowledge absent from the models, an advantage that diminishes as models become more capable."
15,Rethinking LLM Advancement: Compute-Dependent and Independent Paths to Progress,2025-05-07,http://arxiv.org/abs/2505.04075v2,"Restricting compute alone is insufficient for controlling LLM capabilities, as algorithmic innovations can lead to significant performance gains even in compute-constrained environments., AI oversight strategies must expand beyond hardware restrictions to include monitoring and potentially guiding algorithmic research directions., The proposed framework of compute-dependent vs. compute-independent advancements provides a valuable tool for forecasting AI progress and identifying potential areas of concern."
16,DeepCritic: Deliberate Critique with Large Language Models,2025-05-01,http://arxiv.org/abs/2505.00662v1,"LLMs can be effectively trained to provide detailed, step-wise critiques of other LLMs' reasoning processes, significantly improving error identification accuracy compared to existing methods., A two-stage training approach, combining supervised fine-tuning with reinforcement learning, is crucial for developing LLM critics capable of in-depth analysis and feedback., The quality of training data, specifically long-form critiques with multi-perspective verifications, is a key factor in the performance of LLM critics."
17,Scaling Laws For Scalable Oversight,2025-04-25,http://arxiv.org/abs/2504.18530v2,"The paper introduces a framework for quantifying the probability of successful oversight based on the capabilities of the overseer and the overseen system, modeled as a game with oversight-specific Elo scores., The study identifies scaling laws for different oversight games (Mafia, Debate, Backdoor Code, Wargames), approximating how domain performance depends on general AI system capability, and highlights the limitations of single-layer oversight., The paper analyzes Nested Scalable Oversight (NSO) and identifies conditions for its success, determining the optimal number of oversight levels to maximize the probability of oversight success, though success rates vary significantly across different games and decline when overseeing stronger systems."
18,Super Co-alignment of Human and AI for Sustainable Symbiotic Society,2025-04-24,http://arxiv.org/abs/2504.17404v5,"The paper argues that unidirectional imposition of human values on superintelligent AI is insufficient for true alignment, advocating for a 'Super Co-alignment' approach where values are co-shaped by humans and AI., The proposed framework integrates external oversight (human-centered decision making with automated evaluation) and intrinsic proactive alignment (AI understanding of self, others, and society) to achieve continuous alignment., The paper highlights the importance of AI's self-awareness, self-reflection, and empathy in inferring human intentions and prioritizing human well-being, suggesting a move beyond purely behavioral alignment."
19,Adversarial Training of Reward Models,2025-04-08,http://arxiv.org/abs/2504.06141v2,"Adversarial training of reward models is crucial for preventing reward hacking and improving the robustness of RLHF systems, directly addressing a key challenge in scalable oversight., The Adv-RM framework provides a practical method for identifying and mitigating vulnerabilities in reward models, enhancing their reliability and alignment with intended goals., By improving the stability and effectiveness of RLHF training, Adv-RM contributes to the development of more trustworthy and controllable AI agents."
20,A Benchmark for Scalable Oversight Protocols,2025-03-31,http://arxiv.org/abs/2504.03731v1,"The paper addresses a critical gap in the field by providing a systematic empirical framework for evaluating scalable oversight protocols, which is essential for ensuring AI alignment as agents become more capable., The introduction of the Agent Score Difference (ASD) metric offers a quantifiable way to measure the effectiveness of oversight mechanisms in promoting truth-telling over deception, enabling more rigorous comparisons., The provided Python package facilitates rapid and competitive evaluation of different protocols, fostering further research and development in scalable oversight."
21,FindTheFlaws: Annotated Errors for Detecting Flawed Reasoning and Scalable Oversight Research,2025-03-29,http://arxiv.org/abs/2503.22989v1,"The FindTheFlaws dataset directly addresses the need for high-quality, annotated data to evaluate and improve scalable oversight techniques like debate, critique, and prover-verifier games., The performance variation of frontier models across different datasets suggests a strategy for building hierarchical oversight systems, where less capable models can verify the solutions of more capable ones in specific domains., The existence of expert baselines that outperform even top models in certain task/dataset combinations highlights the potential for using human experts as 'gold standard' verifiers in scalable oversight frameworks, especially during initial development and fine-tuning."
22,Superalignment with Dynamic Human Values,2025-03-17,http://arxiv.org/abs/2503.13621v1,"The paper directly addresses the challenge of scalable oversight by proposing a task decomposition approach, aiming to break down complex tasks into human-understandable and supervisable subtasks., It acknowledges the importance of dynamic human values in AI alignment, a crucial aspect often overlooked in scalable oversight research that tends to focus solely on efficiency., The 'part-to-complete generalization hypothesis' is a key assumption that requires empirical validation. If subtask alignment doesn't generalize to complete task alignment, the entire approach could be flawed, highlighting a critical area for future research and potential failure mode."
23,Modeling Human Beliefs about AI Behavior for Scalable Oversight,2025-02-28,http://arxiv.org/abs/2502.21262v2,"Modeling human beliefs about AI behavior is crucial for reliable value learning, especially when AI systems surpass human capabilities and evaluators may misunderstand the AI's actions., The paper introduces the concept of 'belief model covering' as a relaxation technique to reduce the reliance on precise belief models, which can be difficult to obtain in practice., Leveraging internal representations of adapted foundation models to mimic human evaluators' beliefs offers a promising avenue for learning correct values from potentially flawed human feedback."
24,Scalable Oversight for Superhuman AI via Recursive Self-Critiquing,2025-02-07,http://arxiv.org/abs/2502.04675v3,"Recursive self-critiquing offers a potential pathway to scalable oversight by shifting the burden from direct human assessment of complex AI outputs to evaluating critiques of critiques, which may be easier for humans or other AI systems to handle., The paper suggests a hierarchical approach to AI supervision, where higher-order critiques (e.g., critique of critique of critique) can provide more tractable supervision when direct evaluation becomes infeasible due to the AI's superior capabilities., The study explores both Human-AI and AI-AI interaction paradigms, indicating a potential for AI systems to assist in the oversight process, which is crucial for scaling oversight as AI capabilities advance."
25,Great Models Think Alike and this Undermines AI Oversight,2025-02-06,http://arxiv.org/abs/2502.04313v2,"LLM-as-a-judge systems exhibit self-preference, favoring models similar to themselves, which can bias evaluation and oversight., Gains from weak-to-strong generalization in AI oversight are heavily influenced by the complementary knowledge between the weak supervisor and the strong student model. As models become more capable, finding such complementary knowledge becomes harder., Increasing model capabilities correlate with increased similarity in model mistakes, raising concerns about correlated failures in AI oversight systems."
26,The Right to AI,2025-01-29,http://arxiv.org/abs/2501.17899v2,"The paper highlights the importance of community involvement in AI development and governance, which is crucial for scalable oversight. By incorporating diverse perspectives, we can potentially mitigate biases and improve the social responsiveness of AI systems, making them more aligned with human values., The concept of 'data as socially produced' and the call for collective data ownership have significant implications for AI alignment. If data reflects societal biases, AI trained on that data will inherit those biases. Participatory data management could lead to fairer and more representative datasets, ultimately improving AI safety and alignment., The proposed four-tier model for the Right to AI, inspired by Arnstein's Ladder of Citizen Participation, provides a framework for progressively increasing stakeholder involvement in AI oversight. This framework can be adapted and scaled to different contexts, offering a practical approach to ensuring that AI systems are accountable and aligned with societal needs."
27,Debate Helps Weak-to-Strong Generalization,2025-01-21,http://arxiv.org/abs/2501.13124v1,"Debate can be a valuable mechanism for a weak model to extract reliable information from a stronger, potentially untrustworthy model, improving the weak model's performance., Ensembling weak models trained on debate transcripts from strong models can lead to more robust supervision signals for aligning the strong model., Combining weak-to-strong generalization with debate-based supervision shows promise for improving AI alignment, particularly in scenarios where human supervision is limited."
28,Understanding Impact of Human Feedback via Influence Functions,2025-01-10,http://arxiv.org/abs/2501.05790v3,"Influence functions offer a promising method for understanding and mitigating the impact of noisy, inconsistent, or biased human feedback in RLHF, which is crucial for aligning LLMs with human intentions., The paper introduces a compute-efficient approximation of influence functions suitable for large-scale preference datasets and LLM-based reward models, making it practically applicable., The application of influence functions can aid in detecting labeler biases and guiding labelers to refine their strategies, leading to more accurate and consistent feedback, thereby improving the quality of reward models."
29,The Road to Artificial SuperIntelligence: A Comprehensive Survey of Superalignment,2024-12-21,http://arxiv.org/abs/2412.16468v3,"The paper highlights the limitations of current alignment techniques when applied to Artificial Superintelligence (ASI), emphasizing the need for novel approaches that can scale to superhuman capabilities., It identifies scalable oversight as a crucial component of superalignment, focusing on methods to provide high-quality guidance signals for advanced AI systems., The survey format allows for a comprehensive overview of existing methods, their strengths, and weaknesses, providing a valuable resource for researchers in the field."
30,The Superalignment of Superhuman Intelligence with Large Language Models,2024-12-15,http://arxiv.org/abs/2412.11145v2,"The paper explicitly addresses the problem of aligning superhuman AI, particularly LLMs, with human values, which is a core concern in scalable oversight research., It highlights the challenges of scalable oversight when human experts are unable to reliably provide feedback due to the complexity of the task or the model's superior capabilities., The proposed attacker-learner-critic framework provides a concrete structure for developing and testing superalignment algorithms, emphasizing the importance of adversarial robustness and self-improvement."
31,Rethinking LLM Uncertainty: A Multi-Agent Approach to Estimating Black-Box Model Uncertainty,2024-12-12,http://arxiv.org/abs/2412.09572v2,"Existing self-consistency methods for uncertainty estimation in LLMs can be misleading due to contextual biases affecting knowledge retrieval., A multi-agent approach, leveraging diverse query variations, provides a more accurate assessment of LLM uncertainty and improves hallucination detection., The proposed method, DiverseAgentEntropy, offers a theoretically grounded approach to quantifying uncertainty in black-box LLMs, which is crucial for reliable responses and scalable oversight."
32,ProcessBench: Identifying Process Errors in Mathematical Reasoning,2024-12-09,http://arxiv.org/abs/2412.06559v4,"The paper highlights the limitations of existing process reward models (PRMs) in generalizing to more complex mathematical reasoning problems, indicating a need for more robust and generalizable oversight mechanisms., The study demonstrates the potential of using prompted general language models (critic models) for error detection, offering a promising avenue for scalable oversight by leveraging readily available and adaptable models., The ProcessBench dataset provides a valuable resource for benchmarking and improving AI systems' ability to identify errors in reasoning processes, which is crucial for ensuring the reliability and safety of AI agents."
33,Balancing Label Quantity and Quality for Scalable Elicitation,2024-10-17,http://arxiv.org/abs/2410.13215v2,"There exists a quantity-quality tradeoff in labeling data for training AI models, particularly when using pretrained models. Understanding this tradeoff is crucial for scalable oversight, as it impacts the cost-effectiveness of different oversight strategies., Pretrained models possess latent capabilities that can be leveraged to reduce the need for high-quality labels. Elicitation techniques, such as few-shot prompting, can tap into this existing knowledge, improving accuracy at a fixed labeling budget., Different regimes (quantity-dominant, quality-dominant, mixed) exist for eliciting knowledge from pretrained models. The optimal strategy depends on the specific task, the model's pre-existing knowledge, and the cost of obtaining labels of varying quality. Identifying these regimes is important for efficient oversight."
